question,A,B,C,D,answer,reasoning
Với mỗi góc α (0° ≤ α ≤ 180°) thì tỉ số y0/x0 là tan của góc α và ta kí hiệu là tanα=y0/x0.,,,tanα=y0/x0,,C,Do đó ta chọn phương án C.
Hiển thị đáp án ,sinα = yM = \frac{3}{5}; cosα = xM = \frac{4}{5},,,,A,sinα = yM = \frac{3}{5}; cosα = xM = \frac{4}{5}
Câu 2. Với điểm M; ta gọi xOM = α. Khẳng định nào sau đây đúng?,sinα = 3/5 và cosα = 4/5;,sinα = 4/5 và cosα = 3/5;,cosα = 4/5 và cotα = 3/5;,cosα = 3/5 và tanα = 4/5;,C,"Với mọi góc α thỏa mãn 0° ≤ α ≤ 180°, ta luôn có sin(90° – α) = cosα và tan(90° – α) = cotα."
"Với mọi góc α thỏa mãn 0° ≤ α ≤ 180°, ta luôn có sin(90° – α) và tan(90° – α) lần lượt bằng:",cotα và cosα;,sinα và tanα;,cosα và cotα;,cosα và tanα.,C,"Với mọi góc α thỏa mãn 0° ≤ α ≤ 180°, ta luôn có sin(90° – α) = cosα và tan(90° – α) = cotα."
"Với mọi góc α thỏa mãn 0° ≤ α ≤ 180°, ta luôn có cos(180° – α) bằng:",–cosα,cosα,sinα,tanα,A,"Với mọi góc α thỏa mãn 0° ≤ α ≤ 180°, ta luôn có cos(180° – α) = –cosα."
Giá trị của tan103° bằng:,tan77°,-tan77°,cot77°,-cot77°,B,"Quan sát bảng giá trị lượng giác của một số góc đặc biệt, ta có $sin30° = \frac{1}{2}$. Để tính sin30°, ta ấn liên tiếp các phím sau đây: $sin(3)0° = \frac{1}{2}$."
Giá trị của sin30° bằng: ,1/2,1,2/2,-1/2,D,"Nếu góc α thỏa mãn 90° ≤ α ≤ 180° thì α là góc tù. Khi đó sinα > 0, cosα < 0, tanα < 0, cotα < 0. Do đó ta chọn phương án D."
Nếu góc α thỏa mãn 90° ≤ α ≤ 180° thì:,cotα > 0;,tanα > 0;,cosα > 0;,sinα > 0;,C,"Nếu góc α thỏa mãn 90° ≤ α ≤ 180° thì α là góc tù. Khi đó sinα > 0, cosα < 0, tanα < 0, cotα < 0. Do đó ta chọn phương án D."
Cho góc x (0° ≤ x ≤ 180°) mà tanx không xác định. Giá trị của x bằng:,30°,60°,90°,120°,C,"Quan sát bảng giá trị lượng giác của một số góc đặc biệt, ta có tanx không xác định khi x = 90°. Vì vậy x = 90°."
"Sử dụng máy tính cầm tay, giá trị của cot26°32’54’’ xấp xỉ bằng:","2,001","0,4996","-2,001","0,4469",A,"Ta thu được kết quả tan26°32’54’’ ≈ 0,4996353264. Vì cotx = 1/tanx hay cotx = 1/(tanx). Nên để tìm cot26°32’54’’, ta bấm liên tiếp các phím: 1 ÷ Ans. Ta thu được kết quả cot26°32’54’’ ≈ 2,001. Vậy ta chọn phương án A."
Giá trị của sin80° bằng:,cos10°,sin10°,sin100°,Cả A và C đều đúng.,D,Ta có sin80° = sin(90° – 10°) = cos10°. Và sin80° = sin(180° – 100°) = sin100°. Vậy ta chọn phương án D.
Giá trị của biểu thức A = a²sin90° + b²cos90° + c²cos180° bằng:,a² + c²,a² – b² + c²,b² + c²,a² – c²,D,Ta có A = a²sin90° + b²cos90° + c²cos180°. = a².1 + b².0 + c².(–1) = a² – c². Do đó ta chọn phương án D.
Giá trị của biểu thức B = 3 – sin²90° + 2cos²60° – 3tan²45° bằng:,2,\frac{1}{2},-\frac{1}{2},0,A,Ta có B = 3 – sin²90° + 2cos²60° – 3tan²45°. = 3 – 1² + 2.(cos²60°) – 3.1² = 3 – 1 + 2.\frac{1}{2} – 3.1 = 0.
Giá trị của biểu thức P = sinα.cosα + sinβ.cosβ = ?,0,,C. 0,,C,Ta có M = sin50° + cos70° + cos110° – sin130° = sin50° + cos70° – cos70° – sin50° = 0
Giá trị của biểu thức M = sin50° + cos70° + cos110° – sin130° bằng:,–1;,"<math xmlns=""http://www.w3.org/1998/Math/MathML""><mfrac><mn>1</mn><mn>2</mn></mfrac></math>;",0;,1;,C,M = sin50° + cos70° + cos110° – sin130° = 0 + 0 = 0. Vậy ta chọn phương án C.
Giá trị của biểu thức H = cot5°.cot10°.cot15°…cot80°.cot85° bằng:,-1,1,0,2,B,Ta có H = cot5°.cot10°.cot15°…cot(90° – 10°).cot(90° – 5°) = cot5°.cot10°.cot15°…tan10°.tan5° = (cot5°.tan5°).(cot10°.tan10°)…(cot40°.tan40°).cot45° = 1.1…1.cot(45°) = 1.
III. Vận dụng,sin(A+B)/2 = cos(C)/2,tan(A+B-C)/2 = cot(C),cos(A+B) = -cos(C),"All A, B, C are correct",C,M = sin^2 45° – 2sin^2 50° + 3cos^2 45° – 2sin^2 130° + 4tan55°.tan35° = 2 – 2(sin^2 50° + cos^2 50°) + 4tan55°.cot55° = 4
Giá trị của biểu thức M = sin²45° – 2sin²50° + 3cos²45° – 2sin²130° + 4tan55°.tan35° bằng:,1,2,4,5,D,"Vì tanα = –3 nên do đó cosα ≠ 0. Ta có H = 6.sinα - 7.cosα - 7.sinα.cosα = 6.tanα - 7. Vì cosα ≠ 0, nên H = 6.tanα - 7 = 5/3"
Cho biết tanα = –3 (0° ≤ α ≤ 180°). Giá trị của H = sinαα – 7cosαα + 6cosαα + 7sinαα bằng:,"A. <math xmlns=""http://www.w3.org/1998/Math/MathML""><mfrac><mn>4</mn><mn>3</mn></mfrac></math>","B. <math xmlns=""http://www.w3.org/1998/Math/MathML""><mfrac><msqrt><mn>15</mn></msqrt><mn>5</mn></mfrac></math>","C. <math xmlns=""http://www.w3.org/1998/Math/MathML""><mfrac><msqrt><mn>19</mn></msqrt><mn>5</mn></mfrac></math>","D. <math xmlns=""http://www.w3.org/1998/Math/MathML""><mfrac><msqrt><mn>21</mn></msqrt><mn>5</mn></mfrac></math>",B,"Giải thích: Ta có sinα – cosα = 1/√5. ⇒ 2sinαcosα = 4/5. ⇒ sin2α + cos2α = 1, áp dụng Bài tập 5a, trang 65, Sách giáo khoa Toán 10, Tập một. ⇒ sin2α + cos2α = 1 + 2sinαcosα = 1 + 4/5 = 9/5. ⇒ E = √(sin4α + cos4α) = √((9/5)2) = √(81/25) = 3/5."
