question,A,B,C,D,answer,reasoning
Hiển thị đáp án ,A,,,,A,"Biến cố chắc chắn là biến cố luôn xảy ra, kí hiệu là Ω. Do đó phương án B sai. Biến cố không thể là biến cố không bao giờ xảy ra, kí hiệu là ∅. Do đó phương án A đúng. Phép thử ngẫu nhiên (gọi tắt là phép thử) là một hoạt động mà ta không thể biết trước được kết quả của nó. Do đó phương án C sai. Tập hợp tất cả các kết quả có thể có của phép thử ngẫu nhiên được gọi là không gian mẫu. Do đó phương án D sai. Vậy ta chọn phương án A."
Nguyên lí xác suất bé được phát biểu như thế nào?,"Nếu một biến cố có xác suất rất bé thì trong một phép thử, biến cố đó sẽ không xảy ra.","Nếu một biến cố có xác suất rất bé thì trong một phép thử, biến cố đó không chắc sẽ xảy ra.","Nếu một biến cố có xác suất rất bé thì trong một phép thử, biến cố đó chắc chắn sẽ xảy ra.","Nếu một biến cố có xác suất rất bé thì trong một phép thử, biến cố đó có xác suất bằng 0;",D,"Theo Lí thuyết Xác suất, Nguyên lí xác suất bé được phát biểu như sau: Nếu một biến cố có xác suất rất bé thì trong một phép thử, biến cố đó sẽ không xảy ra. Vậy ta chọn phương án D."
Mệnh đề nào sau đây đúng?,A. Biến cố chắc chắn là biến cố không bao giờ xảy ra;,B. Mỗi tập con của không gian mẫu được gọi là một biến cố;,C. Một kết quả thuộc biến cố A được gọi là kết quả làm cho biến cố A không xảy ra;,D. Biến cố có khả năng xảy ra càng cao thì xác suất của nó càng gần 0.,B,"Phương án A sai, vì biến cố chắc chắn là biến cố luôn xảy ra. Phương án C sai, vì một kết quả thuộc biến cố A được gọi là kết quả làm cho biến cố A xảy ra, hoặc kết quả thuận lợi cho biến cố A. Phương án D sai, vì biến cố có khả năng xảy ra càng cao thì xác suất của nó càng gần 1. Vậy ta chọn phương án B."
Một hộp chứa 4 quả cầu trắng và 6 quả cầu xanh có kích thước và khối lượng như nhau. Lấy ngẫu nhiên 3 quả cầu từ trong hộp. Hoạt động nào sau đây không phải là biến cố của phép thử trên?,Ba quả cầu lấy ra cùng màu với nhau;,Ba quả cầu lấy ra có ít nhất một quả màu trắng;,Ba quả cầu lấy ra gồm có ba màu;,Ba quả cầu lấy ra có nhiều nhất hai quả cầu màu xanh.,C,Ta thấy các quả cầu trong hộp chỉ có hai màu là trắng và xanh nên phép thử trên không thể có biến cố: “Ba quả cầu lấy ra gồm có ba màu” được. Do đó hoạt động của phương án C không phải là biến cố của phép thử đã cho.
6. Cho biến cố A có không gian mẫu là Ω và A¯ là biến cố đối của biến cố A. Khẳng định nào sau đây sai?,"P(A) ≥ 0, với mọi biến cố A;",P(∅) = 0;,P(Ω) > 1;,"P(A) ≤ 1, với mọi biến cố A.",C,"0 ≤ P(A) ≤ 1. Do đó phương án A, D đúng. P(Ω) = 1 và P(∅) = 0. Do đó phương án B đúng, phương án C sai. Vậy ta chọn phương án C."
"Lấy ngẫu nhiên hai viên bi từ một thùng có 4 bi xanh, 5 bi đỏ và 6 bi vàng. Số phần tử của không gian mẫu là: ",30,17,105,210,C,"Trong thùng có tổng cộng 4 + 5 + 6 = 15 (viên bi). Lấy ngẫu nhiên hai viên bi trong số 15 viên bi trong thùng mà không quan tâm đến thứ tự thì có C(15,2) = 105. Vậy số phần tử của không gian mẫu là: n(Ω) = 105. Do đó ta chọn phương án C."
Một cầu thủ sút bóng vào cầu môn một lần. Biết rằng xác suất sút vào cầu môn là 3/8. Xác suất không sút vào cầu môn của cầu thủ đó bằng:,3/8,5/8,1/2,0,B,Gọi A: “Cầu thủ sút vào cầu môn”. Ta có biến cố không sút vào cầu môn của cầu thủ là biến cố đối của biến cố sút vào cầu môn. Suy ra P¯A: “Cầu thủ không sút vào cầu môn”. Khi đó P¯A = 1 - P(A) = 1 - 3/8 = 5/8. Vậy ta chọn phương án B.
"Hai xạ thủ bắn vào một tấm bia, xác suất bắn trúng bia của xạ thủ 1 và 2 lần lượt là 0,8 và 0,7. Xạ thủ nào có khả năng bắn trúng thấp hơn?",2,"0,7","0,8",∅,C,"Vì 0,8 > 0,7 nên xạ thủ 2 có khả năng bắn trúng bia thấp hơn xạ thủ 1."
"Từ một hộp chứa 11 quả cầu đỏ và 4 quả cầu xanh, lấy ngẫu nhiên đồng thời 3 quả cầu. Xác suất để lấy được 3 quả cầu màu xanh là:",4/455,24/455,33/91,24/455,B,"Có tất cả 11 + 4 = 15 quả cầu trong hộp. Lấy ngẫu nhiên đồng thời 3 quả cầu (không tính đến thứ tự) thì có C(15,3)=455 cách chọn. Lấy ngẫu nhiên 3 quả cầu xanh trong 4 quả cầu xanh (không tính đến thứ tự) thì có C(4,3)=4 cách chọn. Vậy xác suất để lấy được 3 quả cầu màu xanh là: P(A)=n(A)/n(Ω)=4/455."
Xác suất để lấy được 3 quả cầu màu xanh là:,4/165,4/455,33/91,24/455,B,"Có tất cả 11 + 4 = 15 quả cầu trong hộp. Lấy ngẫu nhiên đồng thời 3 quả cầu (không tính đến thứ tự) thì có C(15,3) = 455 cách chọn. Tức là n(Ω) = 455. Gọi biến cố A: “Lấy được 3 quả cầu màu xanh”. Lấy ngẫu nhiên 3 quả cầu xanh trong 4 quả cầu xanh (không tính đến thứ tự) thì có C(4,3) = 4 cách chọn. Tức là n(A) = 4. Vậy xác suất để lấy được 3 quả cầu màu xanh là: P(A) = n(A)/n(Ω) = 4/455."
Tung một đồng tiền và gieo một con xúc xắc một lần. Số phần tử của không gian mẫu là:,24,12,6,8,C,"Không gian mẫu của biến cố đã cho là Ω = {1; 2; 3; 4; 5; 6}. Suy ra n(Ω) = 6. Trong các số 1; 2; 3; 4; 5; 6, ta có các số chia hết cho 3 là: 3; 6. Suy ra n(A) = 2. Khi đó xác suất của biến cố A là $rac{1}{3}$."
Gieo ngẫu nhiên một xúc xắc 6 mặt cân đối và đồng chất. Xác suất của biến cố A: “Mặt xuất hiện có số chấm chia hết cho 3” là:,1,1/2,1/3,2/3,C,"Không gian mẫu của biến cố đã cho là Ω = {1; 2; 3; 4; 5; 6}. Suy ra n(Ω) = 6. Trong các số 1; 2; 3; 4; 5; 6, ta có các số chia hết cho 3 là: 3; 6. Suy ra n(A) = 2. Khi đó xác suất của biến cố A là P(A) = n(A) / n(Ω) = 2 / 6 = 1/3."
"Trong giỏ có 2 000 nắp khoen bia Tiger, trong đó có 2 nắp ghi “Chúc mừng bạn đã trúng thưởng xe Ford”. Bạn được chọn lên rút thăm lần lượt hai nắp khoen. Xác suất để cả hai nắp khoen đều trúng thưởng là:",1/999000,,,,C,Gọi biến cố M: “Lấy ra 2 chiếc tất cùng màu”. Trong giỏ có 5 đôi tất. Ta suy ra trong giỏ có tổng cộng 10 chiếc tất. Lấy ngẫu nhiên hai chiếc tất trong số 10 chiếc tất trong giỏ (không tính đến thứ tự) thì có 45 cách lấy. Suy ra số phần tử của không gian mẫu là: n(Ω) = 45. Lấy 2 chiếc tất cùng màu từ 10 chiếc tất trong giỏ tức là lấy ra 2 chiếc tất cùng đôi từ giỏ chứa 5 đôi tất. Khi đó số cách lấy là: 5. Suy ra n(M) = 5. Vậy xác suất của biến cố M là: 1/9.
"Một tổ có 9 học sinh, trong đó có 5 học sinh nam và 4 học sinh nữ được xếp thành hàng dọc. Xác suất sao cho 5 học sinh nam đứng kề nhau là:",5/126,121/126,1/126,6/125,"{'answer': 'A', 'reasoning': 'Một tổ có 9 học sinh được xếp thành hàng dọc. Suy ra số phần tử của không gian mẫu là: n(Ω) = 9!. Gọi biến cố A: “5 học sinh nam đứng kề nhau”. • Xếp 5 học sinh nam đứng kề nhau thì sẽ có 5! cách xếp. • Sau đó ta coi 5 học sinh nam là 1 “người A”, rồi xếp “người A” cùng với 4 bạn nữ kia, tức là xếp 5 người, ta lại có 5! cách xếp. Vì vậy n(A) = 5!.5!. Vậy xác suất của biến cố A là: 5/126.'}",
"Một tổ có 9 học sinh, trong đó có 5 học sinh nam và 4 học sinh nữ được xếp thành hàng dọc. Xác suất sao cho 5 học sinh nam đứng kề nhau là:",5/126,121/126,1/126,6/125,A,"Chọn ngẫu nhiên ba đoạn thẳng trong số năm đoạn thẳng và không tính đến thứ tự thì có 10 cách chọn. Gọi biến cố S: “Ba đoạn thẳng được chọn lập thành một tam giác”. Theo bất đẳng thức tam giác, ta có trong một tam giác, tổng độ dài hai cạnh bất kì luôn lớn hơn độ dài cạnh còn lại. Suy ra biến cố S có ba kết quả thuận lợi hay n(S) = 3. Vậy xác suất của biến cố S là: 3/10."
"Xếp ngẫu nhiên 10 học sinh gồm 5 học sinh nam (trong đó có Bình) và 5 học sinh nữ (trong đó có Phương) thành một hàng ngang. Số kết quả thuận lợi cho biến cố A: “Trong 10 học sinh trên không có hai học sinh cùng giới đứng cạnh nhau, đồng thời Bình và Phương cũng không đứng cạnh nhau” là:",4 608,9 216,13 824,18 432,"{'answer': 'D', 'reasoning': 'Chọn vị trí chẵn hoặc lẻ để xếp 5 nam: có 2 cách. Ta xét trường hợp 5 nam ở vị trí chẵn (tương tự cho vị trí lẻ): • Khả năng 1: Bình đứng ngoài cùng: có 1 cách. Xếp Phương không cạnh Bình: có 4 cách. Đổi vị trí các bạn nam: có 4! cách; Đổi vị trí các bạn nữ: 4! cách. Do đó trong khả năng này có 2.1.4.4!.4! = 4 608 cách. • Khả năng 2: Bình không đứng ngoài cùng: có 4 cách. Xếp Phương không cạnh Bình (bỏ 2 vị trí cạnh Bình): có 3 cách. Đổi vị trí các bạn nam: có 4! cách; Đổi vị trí các bạn nữ: có 4! cách. Do đó trong khả năng này có 2.4.3.4!4! = 13 824 cách. Khi đó có 4 608 + 13 824 = 18 432 cách. Vậy số kết quả thuận lợi cho biến cố A là 18 432.'}",
"Xếp ngẫu nhiên 10 học sinh gồm 5 học sinh nam (trong đó có Bình) và 5 học sinh nữ (trong đó có Phương) thành một hàng ngang. Số kết quả thuận lợi cho biến cố A: “Trong 10 học sinh trên không có hai học sinh cùng giới đứng cạnh nhau, đồng thời Bình và Phương cũng không đứng cạnh nhau” là:",4 608,9 216,13 824,18 432,B,Không gian mẫu của phép thử trên là số cách xếp 4 hành khách lên 4 toa tàu. Vì chọn mỗi hành khách có 4 cách chọn toa nên ta có 4<sup>4</sup> cách xếp. Suy ra số phần tử của biến cố A là n(A) = C<sub>4</sub><sup>3</sup>.C<sub>4</sub><sup>1</sup>.C<sub>3</sub><sup>1</sup> = 3/16.
"Có 4 hành khách bước lên một đoàn tàu gồm 4 toa. Mỗi hành khách độc lập với nhau và chọn ngẫu nhiên một toa. Xác suất để 1 toa có 3 người, 1 toa có 1 người và 2 toa còn lại không có ai là:",3/4,13/16,1,8/21,D,"Áp dụng quy tắc nhân, ta suy ra n(Ω) = 7.3 = 21 (mỗi điểm là một giao điểm trên hình). Ta có A: “x, y đều chia hết cho 2”. Suy ra A = {(x; y) | x ∈ {–2; 0; 2; 4} và y ∈ {0; 2}}. Chọn 1 hoành độ (chia hết cho 2) có 4 cách chọn và chọn 1 tung độ (chia hết cho 2) thì có 2 cách chọn. Theo quy tắc nhân, ta có n(A) = 4.2 = 8. Vậy xác suất của biến cố A là: 8/21."
Gieo một con xúc xắc cân đối và đồng chất. Giả sử xúc xắc xuất hiện mặt b chấm. Xác suất để phương trình x² + bx + 2 = 0 có hai nghiệm phân biệt là:,1/3,5/6,1/2,2/3,A,Số phần tử của không gian mẫu là: n(Ω) = 6. Gọi K: “Phương trình x² + bx + 2 = 0 có hai nghiệm phân biệt”. Ta có ∆ = b² – 8. Phương trình x² + bx + 2 = 0 có hai nghiệm phân biệt khi và chỉ khi ∆ > 0 ⇔ b² – 8 > 0 ⇔ b ∈ {3; 4; 5; 6}. Do đó ta nhận b ∈ {3; 4; 5; 6}. Suy ra n(K) = 4. Vậy xác suất của biến cố K là: 2/3.
